platform,keyword,komentar,timestamp,sentimen
twitter,tempo bangkai tikus,"diamnya najwa shihab dan media, teror kepala babi dan bangkai tikus yg dipenggal kepalanya ke jurnalis tempo, dibunuhnya juwita, ilangnya akun ferry irwandi, diserang & disabotasenya tim medis-jurnalis-mobil ambulan bukti nyata bahwa rezim biadab ini sudah gak peduli sama rakyat.",2025-03-27T16:23:19.000Z,
twitter,tempo bangkai tikus,"Teror kiriman kepala babi dan bangkai tikus tanpa kepala kepada Tempo, sudah jadi perhatian media2 mainstream internasional.",2025-03-28T12:02:48.000Z,
twitter,tempo bangkai tikus,"Beberapa waktu lalu, TEMPO diteror kepala babi dan bangkai tikus. Kemudian SUMA UI direpresi, jurnalisnya dipukuli.

Malam ini (23/03), anggota Perhimpunan Pers Mahasiswa Indonesia (PPMI) Kota Malang dipukul secara biadab oleh polisi.

Polisi Malang tidak belajar dari Kanjuruhan.",2025-03-23T14:23:01.000Z,
twitter,tempo bangkai tikus,"Presiden Prabowo Subianto menyebut teror kepala babi dan bangkai tikus ke kantor redaksi Tempo dilakukan oleh mereka yang ingin mengadu domba. 

Tak ada penjelasan siapa domba siapa yang mengadukannya.

#tempodotco #tempo #Prabowo #teror #kepala #babi",2025-04-08T12:09:00.000Z,
twitter,tempo bangkai tikus,Sejauh Mana Pengungkapan Teror Kepala Babi dan Bangkai Tikus ke Tempo,2025-04-14T03:31:47.000Z,
twitter,tempo bangkai tikus,"28 April 2025.
Berbagai kasus sngt rumit pun bisa ditelusuri oleh jurnalis investigasi TEMPO. Tapi kasus kepala babi dan bangkai tikus rasanya lebih susah dari judi online di negara tetangga kamboja.
Mungkin perusahaan ojek online enggan memberikan data? Atau mgkn tempo sdh tahu?",2025-04-28T15:23:51.000Z,
twitter,tempo bangkai tikus,"Dewan Pers menilai siniar Tempo ‘Bocor Alus Politik’ tidak melanggar kode etik dalam penayangan konten berjudul ‘Dugaan Permainan Izin Tambang Menteri Investasi Bahlil Lahadalia’ pada Sabtu, 2 Maret 2024. 

#TempoHeadliner #Bocoraluspolitik #Bahlil",2024-03-20T05:00:04.000Z,
twitter,tempo bangkai tikus,"Majalah tempo diteror dikirimi kepala babi dan bangkai tikus, akun base diancam, sebenernya ini negara apa sih guys? Kok usaha pembungkaman nya semakin terlihat jelas.",2025-03-23T14:33:03.000Z,
twitter,tempo bangkai tikus,"Perhatian⁣
⁣
Video ini mengandung konten sensitif yang bisa mengganggu Anda.⁣
⁣
**⁣
⁣
Setelah paket potongan kepala babi, kantor redaksi Tempo mendapatkan kiriman kedua berupa kotak berisi bangkai tikus yang dipenggal.

Petugas kebersihan Tempo menemukan kardus berisi",2025-03-22T13:44:27.000Z,
twitter,tempo bangkai tikus,PMII meminta aparat penegak hukum untuk mengambil langkah tegas atas peristiwa teror paket berisi kepala babi dan bangkai tikus ke kantor Tempo.,2025-03-24T05:50:02.000Z,
twitter,tempo bangkai tikus,"UPDATE 

Ketua Kelompok Fraksi Gerindra Komisi III DPR Muhammad Rahulsebut strategi playing victim Sun Tzu saat bahas kasus teror kepala babi dan bangkai tikus Tempo. Menurutnya, karena polisi belum menetapkan itu aksi teror, maka harus dikedepankan asas praduga tak bersalah.",2025-03-24T04:24:31.000Z,
twitter,tempo bangkai tikus,"Kami bersama Tempo!

Berita selengkapnya dapat dilihat di sini:",2025-03-22T11:11:36.000Z,
twitter,tempo bangkai tikus,"#MARK 
#THEMOMENTUMinBKK_DAY2
#NCT127_NEOCITY_THE_MOMENTUMinBKK
#NCT127_NEOCITY_BANGKOK_THE_MOMENTUM",2025-02-23T12:21:34.000Z,
twitter,tempo bangkai tikus,"Mengapa Teror Kepala Babi terhadap Tempo Harus Diusut Tuntas

Dalam sepekan terakhir, redaksi Tempo mendapat dua kali serangan teror berupa paket kepala babi dan bangkai tikus. 

#TempoHarian #TempoPlus",2025-03-22T23:45:57.000Z,
twitter,tempo bangkai tikus,"Teror ke 
@tempodotco
 Makin Brutal

Kantor Tempo diteror lagi. 
Kali ini, kardus berisi 6 bangkai tikus ditemuin Sabtu pagi. Bungkusan itu dilempar dini hari oleh orang tak dikenal.

Siapa yg ketakutan sama Tempo?",2025-03-22T11:59:45.000Z,
twitter,tempo bangkai tikus,"Penyelidikan Teror Kepala Babi dan Bangkai Tikus ke Kantor Tempo

Kabareskrim Polri, Komjen Pol. Drs. Wahyu Widada, M.Phil., menyatakan bahwa pihaknya sedang menyelidiki kasus teror berupa kiriman kepala babi dan bangkai tikus ke kantor Tempo. Tim penyelidik telah turun ke",2025-03-25T04:50:03.000Z,
twitter,tempo bangkai tikus,GES KLEN TAU GA KLO TEMPO DIKIRIMIN BANGKAI TIKUS,2025-03-22T13:40:15.000Z,
twitter,tempo bangkai tikus,Teror Kepala Babi dan Bangkai Tikus ke Jurnalis Tempo Diduga Politik Playing Victim,2025-03-24T00:18:42.000Z,
twitter,tempo bangkai tikus,Aneh? What’s actually aneh is your logic. Lo nyinyir karena Tempo sering dapet info A-1 soal kebijakan pemerintah tapi nggak bisa ngelacak siapa yang ngirimin bangkai kepala babi dan tikus? Itu kayak nyalahin dokter karena bisa diagnosa penyakit tapi nggak bisa nangkep maling.,2025-03-23T21:59:47.000Z,
twitter,tempo bangkai tikus,"TEMPO DITEROR KEPALA BABI DAN BANGKAI TIKUS, JUBIR PRESIDEN : ""UDAH DIMASAK SAJA""

https://youtu.be/eVoZz5pFt9Y",2025-03-26T15:38:21.000Z,
twitter,tempo bangkai tikus,"isi tl:
keychain 
ruu tni
gantungan lucu
tempo bangkai tikus
skz mixtape
perempuan melawan",2025-03-23T08:10:23.000Z,
twitter,tempo bangkai tikus,"Oh iya masalah bakar jembatan
Buat yang ngikutin politik baru pasca 2024
Kalian tau tempo? Yang baru2 ini saking kritisnya sampe mobilnya dipecahin dikirimin kepala babi ama bangkai tikus tanpa kepala? 
2014 Tempo juga Mengendorse MLY kok
Karena berharap pemberantasan korupsi",2025-03-22T18:00:17.000Z,
twitter,tempo bangkai tikus,Asal-Usul Leluhur Tikus Komensal #KolomTempo,2025-04-26T02:00:00.000Z,
twitter,tempo bangkai tikus,"Sudahlah, gak ada gunanya juga marah, jangan terlalu percaya apapun yang ada di dunia ini, lebih baik fokus untuk dukung tempo karena beberapa jurnalis internasional sudah up tentang teror kepala babi dan tikus tetep naikin ht #CabutUUTNI #TolakRUUPolri dan #StandWithTempo",2025-03-28T16:27:43.000Z,
twitter,tempo bangkai tikus,"Gimana klo kepala babi dan bangkai tikus yg dikirim ke Tempo beneran dimasak aja, terus kirim balik ke DPR dan ke Hasan Nasbi. Abis gitu kasih notes:

“As per your request, your majesty. Enjoy your meal  “",2025-03-23T05:14:49.000Z,
twitter,tempo bangkai tikus,Bareskrim Polri Selidiki Teror Kepala Babi dan Bangkai Tikus di Kantor Tempo,2025-03-23T13:55:36.000Z,
twitter,tempo bangkai tikus,Robert Bonosusatya alias RBT dalam Pusaran Korupsi PT Timah Tbk yang Rugikan Negara Rp 271 triliun https://metro.tempo.co/read/1851552/robert-bonosusatya-alias-rbt-dalam-pusaran-korupsi-pt-timah-tbk-yang-rugikan-negara-rp-271-triliun?utm_source=Twitter&utm_medium=dlvr.it… #TempoMetro,2024-03-31T06:01:35.000Z,
twitter,tempo bangkai tikus,"""Saya pikir saatnya dihentikan ocehan-ocehan model seperti ini yang selalu menyinggung perasaan publik. Tidak sepantasnya di masa sulit pandemic, hal-hal yang tidak positif dibiarkan,"" ujar Susi Pudjiastuti.
#TempoNasional
https://bit.ly/3iZnTFS",2021-01-29T09:26:11.000Z,
twitter,tempo bangkai tikus,"Bocor Alus akan mengungkap berbagai pembegalan konstitusi dan demokrasi yang dilakukan untuk melanggengkan dinasti Jokowi. 

Bocor Alus hadir dari Universitas Gadjah Mada, Yogyakarta, almamater Jokowi yang juga mengumandangkan perlawanan sengit.

Saksikan LIVE hanya di Youtube",2024-08-25T13:09:00.000Z,
twitter,tempo bangkai tikus,Tempo dikirimin bangkai tikus!!!,2025-03-22T11:03:24.000Z,
twitter,tempo bangkai tikus,"Placing yg ciamik oleh Fajar dan diselesaikan oleh Rian bawa Indonesia unggul 2 - 0 atas Chinese Taipei.

#ThomasCup2024 #TUC2024",2024-05-04T11:18:10.000Z,
twitter,tempo bangkai tikus,Mau jadi chef kepala babi dan bangkai tikus gimana kasus teror ke majalah tempo ? Sama kejadianna saat pengiriman 3 kepala Anjing ke habib bahar..,2025-04-29T14:46:32.000Z,
twitter,tempo bangkai tikus,Tempo Diteror Lagi! Dapat Kiriman 6 Bangkai Tikus Usai Paket Kepala Babi,2025-03-23T03:50:00.000Z,
twitter,tempo bangkai tikus,"Guru Besar UI Tegur Jokowi Soal Bansos Politik Gentong Babi, Sama Seperti yang Diungkap Film Dirty Vote https://nasional.tempo.co/read/1845627/guru-besar-ui-tegur-jokowi-soal-bansos-politik-gentong-babi-sama-seperti-yang-diungkap-film-dirty-vote?utm_source=Twitter&utm_medium=dlvr.it… #TempoNasional",2024-03-16T04:30:04.000Z,
twitter,tempo bangkai tikus,"Dampak Bagi-bagi Komisaris BUMN, Langgengkan KKN, Hancurkan Semangat Anak Muda https://bisnis.tempo.co/read/1837649/dampak-bagi-bagi-komisaris-bumn-langgengkan-kkn-hancurkan-semangat-anak-muda?utm_source=Twitter&utm_medium=dlvr.it… #TempoBisnis",2024-02-25T07:20:06.000Z,
twitter,tempo bangkai tikus,"Survei menunjukkan, warga makin takut berpendapat. Aparat dianggap kian semena-mena menangkap mereka yang berbeda pandangan politik dengan pemerintah. Bahkan pelajar yang berdemo pun ditakut-takuti dengan urusan SKCK. Selengkapnya di #ApaKataTempo https://spoti.fi/3mzi82C",2020-11-02T07:56:36.000Z,
twitter,tempo bangkai tikus,"https://youtu.be/mPRIw1lXQV4

Eks ketua AJI buka konspirasi teror kepala babi & bangkai tikus. Geger! Tempo mau dimatikan. Saksikan selengkapnya di youtube Abraham Samad SPEAK UP. 

Jangan lupa subscribe, comment, like, & share!",2025-03-29T08:24:29.000Z,
twitter,tempo bangkai tikus,"Fakta Kiriman Barang ke Redaksi Tempo: Diduga Upaya Teror, Dari Kepala Babi-Bangkai Tikus",2025-03-23T06:50:00.000Z,
twitter,tempo bangkai tikus,Topoki Instan Termasuk Bumbu 117 gram Tokpokki Teok Kue Teuck dengan harga Rp14.250. Dapatkan di Shopee sekarang! https://s.shopee.co.id/6KrXE3TVHV?share_channel_code=7…,2025-05-01T00:18:24.000Z,
twitter,tempo bangkai tikus,"Kepala Kantor Komunikasi Kepresidenan Hasan Nasbi kini mengaku mendukung kebebasan pers, setelah kantor Tempo mendapat teror paket berisi kepala babi dan enam bangkai tikus.

~LL  #HasanNasbi #KebebasanPers",2025-03-23T05:49:34.000Z,
twitter,tempo bangkai tikus,"Belum lagi pelaku teror pengirim kepala babi terungkap, kantor Redaksi Tempo kembali dikirimi bangkai tikus dengan kondisi kepala terpenggal. #Humaniora #AdadiKompas",2025-03-23T06:46:52.000Z,
twitter,tempo bangkai tikus,Dugaan Akal-akalan Firli Bahuri Paksakan TWK untuk Incar Pegawai KPK https://nasional.tempo.co/read/1469547/dugaan-akal-akalan-firli-bahuri-paksakan-twk-untuk-incar-pegawai-kpk?utm_source=Twitter&utm_medium=Digital%20Marketing&utm_campaign=dlvrit… #TempoNasional,2021-06-06T12:45:07.000Z,
twitter,tempo bangkai tikus,"- Arsip Majalah Tempo - 

SOSIALIS YANG KESEPIAN

Tulisan Budiman Sudjatmiko tentang sosok Soe Hok-gie. http://bit.ly/2toYr7p",2020-01-16T12:07:30.000Z,
twitter,tempo bangkai tikus,"Kantor Tempo Kembali Dapat Kiriman Bangkai Hewan, Setelah Kepala Babi kini 6 Bangkai Tikus",2025-03-23T07:40:00.000Z,
twitter,tempo bangkai tikus,"Kembali Diteror, Tempo Terima Kardus Mawar Berisi Bangkai Tikus yang Dipenggal
 https://nasional.kompas.com/read/2025/03/22/19344431/kembali-diteror-tempo-terima-kardus-mawar-berisi-bangkai-tikus-yang?utm_source=Twitter&utm_medium=Referral&utm_campaign=Top_Mobile…

#BetitaSonora via 
@kompascom",2025-03-23T00:09:57.000Z,
twitter,tempo bangkai tikus,"- Arsip majalah Tempo - 

Tulisan investigasi majalah Tempo tentang perbudakan yang dialami ABK Indonesia di kapal-kapal ikan Taiwan. https://bit.ly/3c8dSlE",2020-05-07T12:06:54.000Z,
twitter,tempo bangkai tikus,"มึง ม่วงตลกกันมาก มันกำลังพยายามบอกตัวเองว่า bb คือ best buddy ไม่ใช่ baby, baobao ถึงแม้ทุกอย่างที่เขียนถึงกันจะหวานมากก็ตาม กุชอบมาก จิ้นแบบกลัวแรงเกิน จิ้นแบบไม่อยากเสพเกินโดส อิสัส กุก็เพิ่งเคยเจอ5555555555555555555555555555555555555",2025-04-20T15:54:58.000Z,
twitter,tempo bangkai tikus,"Wkwkwk. Bener berulang frasa “it takes two to tango.”

Yang lucu adalah kok bisa membayangkan suatu laku atau hubungan yang terjadi karena pemaksaan atau/dan kekerasan sebagai “tango”.

Padahal tango itu sedari awal ya asumsinya kedua belah pihak rida atau merestui.",2024-03-11T00:41:56.000Z,
twitter,tempo bangkai tikus,PT Kereta Cepat Indonesia China perlu menghitung ulang skema pembiayaan pembangunan proyek kereta cepat Jakarta-Bandung. Skema harus dirombak oleh KCIC karena muncul pembengkakan ongkos. #TempoGrafis https://bit.ly/31aXIUU,2021-03-23T12:25:10.000Z,
twitter,tempo bangkai tikus,"TEMPO DITEROR TIKUS MATI.
BESOK BESOK KITA BISA DITEROR SAMPAI MATI.
#TolakRUUTNI",2025-03-22T11:53:25.000Z,
twitter,tempo bangkai tikus,"Di novel Animal Farm, George Orwell menulis alegori tentang kekuasaan dan bagaimana suara-suara kecil bisa ditekan oleh yang paling keras teriak.

Di Tempo, kami percaya sebaliknya: suara jernih harus tetap lantang. Bahkan ketika babi pakai dasi memimpin kandang, bahkan ketika",2025-04-16T13:03:40.000Z,
twitter,tempo bangkai tikus,"Film Dirty Vote Narasikan Bawaslu Tak Berani Proses Pelanggaran Kampanye, Rahmat Bagja: Silakan Saja Kritik https://nasional.tempo.co/read/1832338/film-dirty-vote-narasikan-bawaslu-tak-berani-proses-pelanggaran-kampanye-rahmat-bagja-silakan-saja-kritik?utm_source=Twitter&utm_medium=dlvr.it… #TempoNasional",2024-02-12T00:26:33.000Z,
twitter,tempo bangkai tikus,"Pernyataan sikap Komnas Ham dan LPSK merespons laporan Komite Keselamatan Jurnalis dalam kasus teror kepala babi dan bangkai tikus ke jurnalis ""Tempo"". #Polhuk #AdadiKompas 

https://kompas.id/artikel/komnas-ham-dan-lpsk-tanggapi-teror-tempo??utm_source=twitter&utm_medium=post&utm_campaign=soc_hariankompas_polhuk-auto_traffic…",2025-03-27T07:19:33.000Z,
twitter,tempo bangkai tikus,"UKT Terus Naik, BEM UI: Kampus Tak Terbuka, Mahasiswa Seolah Beli Kucing Dalam Karung https://nasional.tempo.co/read/1864519/ukt-terus-naik-bem-ui-kampus-tak-terbuka-mahasiswa-seolah-beli-kucing-dalam-karung?utm_source=Twitter&utm_medium=dlvr.it… #TempoNasional",2024-05-06T07:41:05.000Z,
twitter,tempo bangkai tikus,"Video: Seusai Teror Kepala Babi, Kini Kantor Tempo Dikirimi Bangkai Tikus Terpenggal",2025-03-22T14:05:51.000Z,
twitter,tempo bangkai tikus,"Paket 'Kado' Bunga Mawar Merah, Begini Kronologi Teror Bangkai Tikus di Kantor Tempo",2025-03-22T21:05:17.000Z,
twitter,tempo bangkai tikus,Lembaga Perlindungan Saksi dan Korban (LPSK) menyiapkan perlindungan bagi jurnalis media Tempo yang mendapatkan teror pengiriman kepala babi dan bangkai tikus.,2025-03-27T23:30:00.000Z,
twitter,tempo bangkai tikus,Komnas HAM mengecam teror kiriman kepala babi dan bangkai tikus terhadap kantor Tempo. Komnas HAM menilai ada upaya untuk mengancam dan menekan Tempo.,2025-03-24T04:20:00.000Z,
twitter,tempo bangkai tikus,"Siapa sebenarnya yang mengirimkan kepala babi dan bangkai tikus ke Tempo? Apakah teror itu terkait dengan penguasa? Apa pula yang seharusnya dilakukan pemerintah agar pers dan rakyat punya jaminan keamanan dan kebebasan?

Saksikan selengkapnya di 

https://youtube.com/watch?v=Bsq89ZJOPBM…",2025-03-26T02:14:02.000Z,
twitter,tempo bangkai tikus,"Teror Kepala Babi dan Bangkai Tikus ke Tempo, LPSK: Ancaman bagi Pembela HAM",2025-03-23T12:26:57.000Z,
twitter,tempo bangkai tikus,IM57+ Institute meminta pemerintah turun tangan terkait teror pengiriman kepala babi dan bangkai tikus ke Kantor Media Tempo. Ancaman itu tidak bisa dianggap candaan belaka.,2025-03-24T13:50:00.000Z,
twitter,tempo bangkai tikus,LPSK Beri Perlindungan ke Jurnalis Tempo Buntut Aksi Teror Kepala Babi dan Bangkai Tikus,2025-03-28T03:00:04.000Z,
twitter,tempo bangkai tikus,บังทันจะไปออกรายการ Tokopedia WIB TV show ของอินโดนีเซีย วันจันทร์ที่ 25  มกราคมนี้ เวลาประมาณ 2 ทุ่มไทย รอติดตามกันนนน,2021-01-18T05:42:43.000Z,
twitter,tempo bangkai tikus,"Jelang Kiriman Bangkai Tikus, Terkuak Pesan Teror ke Redaksi Tempo: Mampus Kalian!",2025-03-23T06:32:22.000Z,
twitter,tempo bangkai tikus,"Rugikan Negara Rp 271 Triliun, Tambang Timah Ilegal di Bangka Belitung Bikin Hutan Tropis Hilang hingga Korban Jiwa https://metro.tempo.co/read/1851479/rugikan-negara-rp-271-triliun-tambang-timah-ilegal-di-bangka-belitung-bikin-hutan-tropis-hilang-hingga-korban-jiwa?utm_source=Twitter&utm_medium=dlvr.it… #TempoMetro",2024-03-31T02:38:05.000Z,
twitter,tempo bangkai tikus,"Politisasi Bansos, Guru Besar Paramadina: Jokowi Tergoda Rezim Neo-otoritarianisme https://bisnis.tempo.co/read/1831005/politisasi-bansos-guru-besar-paramadina-jokowi-tergoda-rezim-neo-otoritarianisme?utm_source=Twitter&utm_medium=dlvr.it… #TempoBisnis",2024-02-08T00:58:09.000Z,
twitter,tempo bangkai tikus,"Pinokio di Tempo:  Cover Akbar Agak Vulgar, Jokowi Lebih Keren",2019-09-17T22:25:01.000Z,
twitter,tempo bangkai tikus,Fakta-Fakta Teror Kiriman Paket Isi Kepala Babi dan 6 Bangkai Tikus ke Kantor Tempo,2025-03-23T09:16:07.000Z,
twitter,tempo bangkai tikus,Bekas Pimpinan Komisi Pemberantasan Korupsi Busyro Muqoddas menyebut fenomena banditisme politik telah melembaga di Indonesia saat ini.  #TempoNasional https://bit.ly/3gyAtg6,2021-04-21T00:21:07.000Z,
twitter,tempo bangkai tikus,"Nggak, Nina. Di sini terang, kemarin doang hujannya. Apa ya.. kamu suka lagu yang kayak apa? Aku mau nyaranin lagu tempo by kyu, itu bagus banget.",2025-04-26T17:14:58.000Z,
twitter,tempo bangkai tikus,"Lama tak terdengar, nama taipan Kaharudin Ongko kembali mencuat ke permukaan setelah Satgas BLBI memanggilnya untuk menyelesaikan utang sebesar Rp 8,2 T. #TempoBisnis",2021-09-07T01:15:30.000Z,
twitter,tempo bangkai tikus,"Pasca teror kepala babi & 6 bangkai tikus

Waduh
Web Tempo jd sasaran 120 juta serangan siber DDoS & server down sejak Selasa 8 April 2025 saat publish konten premium “Tentakel Judi Kamboja” https://tempo.co/digital/tempo-kembali-alami-serangan-siber-ddos-banyak-berita-tak-bisa-diakses-publik-1228930…
https://x.com/joe_pride888/status/1909475470858764604/video1…
Notif Prabowo usai ketemu pimred ga laku",2025-04-09T09:20:30.000Z,
twitter,tempo bangkai tikus,"Komisioner Komnas Hak Asasi Manusia (HAM) Anis Hidayah mengecam pengiriman kepala babi dan bangkai tikus ke kantor Tempo sebagai bentuk teror yang ditujukan kepada pembela HAM.

~LL #Tempo #KomnasHAM",2025-03-27T12:57:16.000Z,
twitter,tempo bangkai tikus,Karangan Bunga Dukung Pencopotan Baliho Rizieq Shihab Banjiri Kodam Jaya https://metro.tempo.co/read/1408045/karangan-bunga-dukung-pencopotan-baliho-rizieq-shihab-banjiri-kodam-jaya?utm_source=Digital%20Marketing&utm_medium=Twitter&utm_campaign=dlvrit… #TempoMetro,2020-11-23T10:14:02.000Z,
twitter,tempo bangkai tikus,Teror kiriman paket berisi kepala babi dan bangkai tikus ke kantor Redaksi ”Tempo” merupakan ancaman pada kebebasan pers.  Demokrasi terancam ketika pers terancam. #Opini #AdadiKompas,2025-03-27T00:07:30.000Z,
twitter,tempo bangkai tikus,AHY Angkat Suara Terkait Kantor Tempo Diteror Kepala Babi dan Bangkai Tikus - Forum Keadilan,2025-03-24T10:52:37.000Z,
twitter,tempo bangkai tikus,"Eks Komisioner Komisi Pemberantasan Korupsi Busyro Muqoddas meminta Presiden Joko Widodo agar tidak mengabaikan aspirasi masyarakat sipil yang menolak tes TWK. #TempoNasional 
https://bit.ly/3c6RlYy",2021-05-31T13:46:51.000Z,
twitter,tempo bangkai tikus,"Live Bocor Alus Politik: Kongkalikong Istana dan DPR Mengadali Putusan MK

 https://youtube.com/live/aUuSdKXaAIc?si=osHy9pHVW6P1xegO… ",2024-08-22T02:22:33.000Z,
twitter,tempo bangkai tikus,"Tempo dpt kiriman Bangkai Tikus dipenggal !
Media Tempe bikin publik marah selama ini atas berita2 hoax, fitnah tak bermutu.
@tempodotco
 @korantempo
 @BSemeru4572
 @BudiHar73497395
 @MaliqRidwane
 @sukardiyahya162
 @SigitWasito8
 @DharmaSayoga
 @Mindra_AZ
 @Sukma_Ekalaya
 @AkbarM777",2025-03-23T05:41:27.000Z,
twitter,tempo bangkai tikus,"Kantor redaksi Tempo kembali mendapat kiriman paket kedua berupa kotak berisi bangkai tikus yang dipenggal, setelah sebelumnya berupa paket potongan kepala babi.

Paket ini ditemukan oleh petugas kebersihan Tempo pada Sabtu, 22 Maret 2025, pukul 08.00 WIB.

Petugas kebersihan",2025-03-22T22:00:08.000Z,
twitter,tempo bangkai tikus,"ฉันจะบอกว่ารักให้เธอได้ยินสักหมื่นครั้ง~ ฟังแล้วน้วยมากกก ละมุนใจละลายจิตสุดๆเลย 

ขอบคุณเพลงรักหวานละมุนใจจากนุนิวนะคะ 

#RHYTHMSOFBANGKOKxTYTAN #RHYTHMSOFBANGKOK
#onebangkokretail #CatRadio #ฤดูของเธอ #NuNew #TYTAN #ไทแทน #TTsThunders",2024-11-03T16:23:59.000Z,
twitter,tempo bangkai tikus,"Beberapa teknis instrumen terasa nanggung. Fill in drum nanggung, synth nanggung dan kurang masuk, bass nanggung. Jadi, secara keseluruhan musik yang diramu tidak terlalu matang. ""Bangkit"" pada dasarnya enak-enak aja, tapi eksekusi di mixing yang kurang pas aja.",2025-04-27T08:44:27.000Z,
twitter,tempo bangkai tikus,"Aksi teror berupa pengiriman kepala babi dan bangkai tikus tanpa kepala ke kantor Tempo mendapat kecaman keras dari berbagai pihak, termasuk Ketua Umum Pasukan Bawah Tanah (Pasbata), David Febrian. Ia menegaskan bahwa tindakan tersebut adalah provokasi yang bertujuan mengadu",2025-03-26T01:00:11.000Z,
twitter,tempo bangkai tikus,"เริ่ดเกิน ในห้างที่ฝูโจวเปิดเพลงบิวกิ้นประชันกันสุดๆ  

Light TEMPO up at Fuzhou
#พี่บิวกิ้นใจฟูที่ฝูโจว 
#BillkinTempoTour2024Fuzhou
#Bbillkin",2024-03-16T06:00:17.000Z,
twitter,tempo bangkai tikus,"NOW! 
Pre-Order 'Billkin Tempo Collection' 

on website WAAW BKK (http://waawbkk.com)
เปิดพรีออเดอร์ตั้งแต่วันนี้ ถึงวันที่ 30 NOV 2023 (12 AM | GMT+7)

 เริ่มจัดส่งเดือนกุมภาพันธ์ 2024
รีบกดก่อนหมดอีกรอบ !

---
Tempo Limited Edition Hoodie 
THB 2,590.-
Color : Blue /",2023-11-06T11:08:59.000Z,
twitter,tempo bangkai tikus,"NOW! 
Pre-Order 'Billkin Tempo Collection' 

on website WAAW BKK (http://waawbkk.com)
เปิดพรีออเดอร์ตั้งแต่วันนี้ ถึงวันที่ 30 NOV 2023 (12 AM | GMT+7)

 เริ่มจัดส่งเดือนกุมภาพันธ์ 2024
รีบกดก่อนหมดอีกรอบ !

---
Tempo Limited Edition Hoodie 
THB 2,590.-
Color : Blue /",2023-11-06T11:03:04.000Z,
twitter,tempo bangkai tikus,"[]
@BTS_twt
 estará en Tokopedia WIB TV Show este martes 17 de agosto

#TokopediaxBTS  

 Derretiré tu corazón en dos.
 En 3 días, tu corazón se derretirá en Tokopedia WIB TV Show.
 Así que descarga la aplicación de Tokopedia ahora.

(+)",2021-08-14T02:53:12.000Z,
twitter,tempo bangkai tikus,"Kalau buka 7 hari seminggu dari pagi pukul 8 sampai petang pukul 7 pun tak boleh cari masa buat urusan di UTC, pergi mampus saja lah. Macam ko je seorang di dunia yang sibuknya bukan main, atur masa pun tak pandai.",2018-12-13T15:03:09.000Z,
twitter,tempo bangkai tikus,"""Teror"" Kepala babi tanpa kuping dan bangkai tikus tanpa kepala dikirim ke Kantor Tempo. 

Saksikan wawancara Radio Elshinta bersama Pemimpin Redaksi Tempo Sestri Yasra, Minggu (23/3) pukul 17.05 WIB

LIVE di Radio Elshinta 90FM

#tempo #teror",2025-03-23T04:59:31.000Z,
twitter,tempo bangkai tikus,"HOLA ARMY PREPARENSE  
@BTS_twt
 aparecerá en el evento 'Tokopedia Indonesia' 10PM KST...

 HORARIOS ( 25/ ENERO)
07:00AM: 
08:00AM: 
09:00AM: 
10:00AM: 
02:00PM: 

LINKS | ©jiminievenus

#TokopediaXBTS",2021-01-18T15:42:27.000Z,
twitter,tempo bangkai tikus,"INFO 
@BTS_twt
El día de mañana se presentará BTS en el evento ""Waktu Indonesia Belanja"" de Tokopedia

El evento será transmitido
en vivo a las 10 PM KST a través de YouTube:

https://bit.ly/3iLUoaz

Mxr~
Cr. tokopedia
#BTS #방탄소년단",2021-01-25T03:57:32.000Z,
twitter,ancaman tempo,"bukan cuma pers. tapi kepada perempuan. kepada suara perempuan. ibu suciwati pernah dapat ancaman pembunuhan ketika menuntut keadilan atas suaminya. najwa shihab dibakar bukunya karena menyuarakan Indonesia darurat. sekarang cica, jurnalis tempo. ini kekerasan berbasis gender.",2025-03-21T17:49:32.000Z,
twitter,ancaman tempo,"Hari ini Bu Sumarsih dan teman2 masyarakat sipil datang membawa bunga2. Beribu terima kasih atas dukungan dan semangat dari tmn2. Sesungguhnya ancaman, teror, ini bukan hanya untuk saya, utk Tempo, tp kita masy sipil yang memperjuangkan kebebasan pers dan kebebasan bereskpresi.",2025-03-21T07:30:23.000Z,
twitter,ancaman tempo,"Ngirimin kepala babi sama tikus kepenggal ke redaksi Tempo adalah ancaman buat demokrasi.

Media tuh tugasnya nyuarain, bukan ditakut-takutin.

Kalo wartawan dibikin ciut, siapa lagi yang bisa kita andelin buat bongkar borok?

Eh lupa, kan yang bobrok…..)#:$;9@82)",2025-03-22T11:40:38.000Z,
twitter,ancaman tempo,"Ancaman Pidana untuk Produk Haram Berlabel Halal

Badan Penyelenggara Jaminan Produk Halal bersama BPOM menarik sembilan produk pangan olahan dari peredaran karena terbukti mengandung unsur babi (porcine). 

Padahal tujuh dari sembilan produk itu sudah mengantongi sertifikat",2025-04-27T00:13:02.000Z,
twitter,ancaman tempo,"Anggota polisi itu juga mengeluarkan ancaman verbal kepada para jurnalis. Dia terdengar mengatakan kalimat, ""kalian pers, saya tempeleng satu-satu.""

Galak ya polisi...",2025-04-06T11:05:21.000Z,
twitter,ancaman tempo,"Situs Web Narasi TV Diretas, Terima Pesan Ancaman 'Diam atau Mati' https://nasional.tempo.co/read/1640298/situs-web-narasi-tv-diretas-terima-pesan-ancaman-diam-atau-mati?utm_source=Twitter&utm_medium=Digital%20Marketing&utm_campaign=dlvrit… #TempoNasional",2022-09-30T14:13:09.000Z,
